Timestamp,SR.No,Text,Username,Platform,Hashtags,Retweets,Likes,Country,Sentiment_score,Sentiment
2021-02-28 13:00:00,376,Chasing dreams like a kite soaring high in the vast open sky.      , SkyDreamer      , Twitter  , #DreamChaser #SkyHighDreams              ,30,60, Australia         ,0.6369,Positive
2018-06-12 20:30:00,377,Spellbound by the elegance of a ballroom dance under crystal chandeliers. , DanceEnthusiast , Facebook , #Elegance #BallroomDance                ,28,55, UK               ,0.4767,Positive
2016-03-08 14:20:00,378,Whimsical delight in a world of fairy tales and magical creatures.  , FairyTaleExplorer , Instagram , #Whimsy #MagicalWorld                    ,20,40, USA             ,0.6369,Positive
2023-04-18 17:10:00,379,Pensive contemplation amid the ancient ruins of a forgotten civilization. , RuinsExplorer   , Twitter  , #Pensive #AncientCivilization           ,18,35, Greece           ,-0.5423,Negative
2020-07-25 12:45:00,380,Embracing the thrill of speed on a rollercoaster's exhilarating twists. , RollercoasterFan , Facebook , #Thrill #RollercoasterAdventure        ,22,45, Germany         ,0.6369,Positive
2019-11-30 19:30:00,381,Harmony resonates as musicians play a melody of unity and togetherness. , MusicHarmonist  , Instagram , #Harmony #MusicalUnity                   ,35,70, Sweden          ,0.6249,Positive
2015-09-01 16:00:00,382,A burst of creativity in the quiet solitude of an artist's studio.  , StudioArtist    , Twitter  , #Creativity #ArtistsHaven               ,15,30, Italy           ,0.3818,Positive
2022-05-05 10:15:00,383,Radiant joy akin to blooming flowers on a sun-kissed spring morning. , SpringEnthusiast , Facebook , #Radiance #SpringBlooms                 ,25,50, Netherlands     ,0.7845,Positive
2018-07-08 23:00:00,384,A sense of wonder at the vastness of the cosmos on a stargazing night. , CosmosExplorer  , Instagram , #Wonder #StargazingAdventure            ,40,80, South Africa    ,0.0,Neutral
2021-09-20 14:30:00,385,Rejuvenated by the salty breeze and the sound of waves at the seaside. , SeaBreezeLover , Twitter  , #Rejuvenation #SeasideEscape            ,18,35, Spain           ,0.0,Neutral
2016-11-15 11:45:00,386,Whispers of inspiration from the rustling leaves in a serene forest. , ForestDreamer   , Facebook , #Inspiration #ForestWhispers            ,28,55, Portugal        ,0.7506,Positive
2020-01-12 18:00:00,387,Savoring the warmth of a cup of cocoa on a chilly winter evening.   , WinterWarmth    , Instagram , #Coziness #WarmWinterEvening           ,30,60, Switzerland     ,0.4588,Positive
2017-12-28 19:15:00,388,Heartfelt gratitude for the laughter shared during a family reunion. , FamilyGatherer , Facebook , #Gratitude #FamilyLaughter              ,22,45, Austria         ,0.9081,Positive
2019-03-02 20:20:00,389,"Embarking on a culinary adventure, savoring exotic flavors around the world. ", CulinaryExplorer , Twitter  , #Adventure #CulinaryJourney             ,35,70, Belgium         ,0.3182,Positive
2022-06-08 15:30:00,390,Euphoria floods in as the final puzzle piece clicks into place.       , PuzzleSolver    , Instagram , #Euphoria #PuzzleCompletion            ,20,40, Denmark         ,0.6486,Positive
2018-08-18 14:45:00,391,Awe-inspired by the grandeur of an ancient cathedral's intricate architecture. , CathedralVisitor , Facebook , #Awe #ArchitecturalGrandeur            ,18,35, Czech Republic  ,0.6124,Positive
2022-08-10 22:00:00,392,Captivated by the ethereal beauty of a field filled with fireflies. , NightSkyObserver , Instagram , #Enchantment #FireflyField              ,25,50, Brazil           ,0.7506,Positive
2019-04-05 17:30:00,393,Immersed in the enchanting melodies of a street musician's violin. , MusicLover      , Twitter  , #Melodic #StreetMusic                   ,18,35, France           ,0.0,Neutral
2020-12-15 15:45:00,394,Joyful laughter resonates through a lively summer carnival.         , CarnivalGoer    , Facebook , #FestiveJoy #SummerCarnival             ,22,45, Japan            ,0.875,Positive
2017-10-20 08:15:00,395,Exploring the universe within during a mindful meditation session. , MindfulExplorer , Instagram , #InnerJourney #MeditationBliss          ,35,70, Canada           ,0.0,Neutral
2021-02-28 13:00:00,396,Soaring like a free spirit on the winds of a coastal cliff.        , CoastalExplorer , Twitter  , #Freedom #CoastalAdventure              ,30,60, Australia         ,0.7579,Positive
2018-06-12 20:30:00,397,Dazzled by the elegance of a masquerade ball's dazzling costumes. , MasqueradeAttendee , Facebook , #Dazzle #MasqueradeElegance            ,28,55, UK               ,0.4767,Positive
2016-03-08 14:20:00,398,Whimsical delight in a world of whimsical fairy tales.             , FairyTaleAdventurer , Instagram , #Whimsy #FairyTaleMagic                 ,20,40, USA             ,0.6705,Positive
2023-04-18 17:10:00,399,Reflective contemplation amid the ruins of a forgotten era.        , RuinsExplorer   , Twitter  , #Reflection #ForgottenEra               ,18,35, Greece           ,-0.5859,Negative
2020-07-25 12:45:00,400,Riding the adrenaline rush on a rollercoaster's wild twists.      , ThrillSeeker    , Facebook , #Adrenaline #RollercoasterThrills      ,22,45, Germany         ,0.0,Neutral
2019-11-30 19:30:00,401,Harmony resonates as musicians play a symphony of unity.           , MusicHarmonist  , Instagram , #Harmony #MusicalUnity                   ,35,70, Sweden          ,0.6249,Positive
2015-09-01 16:00:00,402,A burst of artistic creativity in the quietude of an artist's studio. , StudioArtist    , Twitter  , #ArtisticBurst #StudioCreativity       ,15,30, Italy           ,0.3818,Positive
2022-05-05 10:15:00,403,Radiant joy akin to blossoming flowers on a sunlit spring morning. , SpringEnthusiast , Facebook , #Radiance #SpringBlooms                 ,25,50, Netherlands     ,0.7845,Positive
2018-07-08 23:00:00,404,Awe-inspired by the vastness of the cosmos on a stargazing night.   , CosmosExplorer  , Instagram , #Wonder #StargazingAdventure            ,40,80, South Africa    ,0.0,Neutral
2021-09-20 14:30:00,405,Rejuvenated by the salty breeze and the sound of waves at the seaside. , SeaBreezeLover , Twitter  , #Rejuvenation #SeasideEscape            ,18,35, Spain           ,0.0,Neutral
2016-11-15 11:45:00,406,Whispers of inspiration from the rustling leaves in a serene forest. , ForestDreamer   , Facebook , #Inspiration #ForestWhispers            ,28,55, Portugal        ,0.7506,Positive
2020-01-12 18:00:00,407,Savoring the warmth of a cup of cocoa on a chilly winter evening.   , WinterWarmth    , Instagram , #Coziness #WarmWinterEvening           ,30,60, Switzerland     ,0.4588,Positive
2017-12-28 19:15:00,408,Heartfelt gratitude for the laughter shared during a family reunion. , FamilyGatherer , Facebook , #Gratitude #FamilyLaughter              ,22,45, Austria         ,0.9081,Positive
2019-03-02 20:20:00,409,"Embarking on a culinary odyssey, savoring flavors around the world. ", CulinaryExplorer , Twitter  , #CulinaryOdyssey #FlavorsAroundTheWorld ,35,70, Belgium         ,0.0,Neutral
2022-06-08 15:30:00,410,Euphoria floods in as the final puzzle piece fits perfectly.       , PuzzleSolver    , Instagram , #Euphoria #PerfectPuzzle               ,20,40, Denmark         ,0.8591,Positive
2018-08-18 14:45:00,411,Awe-struck by the grandeur of an ancient cathedral's intricate architecture. , CathedralVisitor , Facebook , #Awe #ArchitecturalGrandeur            ,18,35, Czech Republic  ,0.6124,Positive
2015-11-08 10:00:00,412,Curiosity awakened by the mysteries of an ancient archaeological site. , ArchaeologyEnthusiast , Instagram , #Curiosity #AncientMysteries          ,18,35, Australia ,0.0,Neutral
2020-12-02 17:30:00,413,Giddy with excitement as the first snowflakes dance from the sky. , SnowfallEnthusiast , Twitter  , #Excitement #SnowfallMagic             ,22,45, Canada         ,0.3818,Positive
2017-06-10 12:15:00,414,Contentment envelops as the aroma of freshly baked bread fills the air. , BreadLover     , Instagram , #Contentment #FreshBreadAroma          ,28,55, France          ,0.3612,Positive
2021-04-15 14:20:00,415,Inspired by the resilience of a lone tree standing tall in a storm. , NatureResilient , Facebook , #Resilience #StandingTall              ,35,70, USA             ,0.2732,Positive
2019-09-28 19:45:00,416,"Lost in the pages of a captivating novel, transported to another world. ", Bookworm       , Twitter  , #Immersion #CaptivatingNovel           ,20,40, UK              ,0.0,Neutral
2016-12-05 21:00:00,417,Drenched in nostalgia while flipping through an old family photo album. , FamilyHistorian , Instagram , #Nostalgia #FamilyPhotoAlbum           ,25,50, India          ,0.0,Neutral
2018-02-10 23:30:00,418,Spark of inspiration ignites like a shooting star in the night sky. , NightSkyWatcher , Facebook , #Spark #InspirationIgnited             ,30,60, Australia      ,0.7783,Positive
2023-02-15 08:30:00,419,Imbued with gratitude for the simple pleasure of a warm cup of tea. , TeaEnthusiast  , Twitter  , #Gratitude #WarmTea                    ,18,35, Japan           ,0.836,Positive
2015-08-22 15:00:00,420,Marveling at the kaleidoscope of colors in a vibrant street market. , MarketExplorer , Instagram , #Marvel #ColorfulStreetMarket          ,22,45, Brazil          ,0.5267,Positive
2020-11-20 18:45:00,421,Awash with serenity as the sun sets over a tranquil lakeside retreat. , LakesideRetreater , Facebook , #Serenity #TranquilSunset              ,28,55, Germany       ,0.25,Positive
2019-08-05 21:00:00,422,Drowning in sorrow as memories of lost love resurface.            , LostInLove      , Instagram , #Heartbreak #LostLove                    ,15,30, USA             ,-0.128,Negative
2021-02-12 16:45:00,423,Numbness sets in as the weight of loneliness grows heavier.       , SolitudeSeeker , Twitter  , #Loneliness #HeavyHeart                  ,18,35, Canada          ,-0.5994,Negative
2020-11-28 14:20:00,424,"Tears fall like raindrops, mourning the end of a cherished friendship. ", FriendshipsEnd  , Facebook , #Grief #LostFriendship                  ,22,45, UK              ,0.5994,Positive
2016-05-15 22:30:00,425,"Despair clouds the mind, feeling adrift in an endless sea of darkness. ", LostInDarkness  , Instagram , #Despair #EndlessDarkness               ,28,55, Australia        ,-0.4215,Negative
2018-09-10 13:15:00,426,"Shattered by betrayal, trust crumbles like fragile glass.          ", BrokenTrust     , Twitter  , #Betrayal #ShatteredTrust               ,22,45, Germany         ,-0.2732,Negative
2022-03-20 19:30:00,427,"Aching heart, the symphony of pain plays in the silence of solitude. ", SilentSufferer  , Facebook , #Suffering #HeartacheSymphony          ,25,50, Brazil          ,-0.6705,Negative
2017-07-18 17:45:00,428,"Emotional storm, a whirlwind of sadness engulfs every thought.    ", StormyFeelings  , Instagram , #EmotionalStorm #SadnessWhirlwind      ,30,60, India          ,-0.3182,Negative
2018-12-15 10:00:00,429,"Haunted by regrets, the ghost of the past lingers relentlessly.   ", LingeringGhost  , Twitter  , #Regret #HauntedPast                    ,18,35, France         ,-0.7845,Negative
2015-06-28 21:15:00,430,"Torn apart by grief, the echoes of loss reverberate through the soul. ", EchoesOfLoss    , Facebook , #Grief #TornApart                       ,28,55, Italy         ,-0.7579,Negative
2020-04-02 14:20:00,431,"Isolation deepens, an emotional winter where warmth is but a distant memory. ", WinterOfEmotions , Instagram , #Isolation #EmotionalWinter            ,35,70, Japan       ,0.1154,Positive
2019-10-08 18:30:00,432,"Soul-crushing disappointment, hopes shattered like fragile glass. ", ShatteredHopes  , Twitter  , #Disappointment #CrushedHopes          ,20,40, Spain        ,-0.2732,Negative
2016-11-22 09:45:00,433,"Painful echoes of a love once cherished, now lost in the abyss of time. ", AbyssOfTime     , Facebook , #LostLove #PainfulEchoes               ,22,45, Netherlands  ,0.5106,Positive
2022-08-18 22:00:00,434,"Heartache deepens, a solitary journey through the abyss of despair. ", SolitaryDescent , Instagram , #Despair #AbyssOfHeartache             ,40,80, South Africa ,-0.3182,Negative
2017-03-12 23:30:00,435,"Melancholy lingers, a bittersweet serenade in the quietude of solitude. ", SerenadeOfSolitude , Twitter , #Melancholy #QuietSerenade             ,18,35, UK         ,-0.4939,Negative
2015-12-15 16:15:00,436,"Bitterness like a poison, seeping into every crevice of the wounded heart. ", PoisonedHeart   , Facebook , #Bitterness #WoundedHeart              ,25,50, Australia   ,-0.5719,Negative
2021-09-05 13:30:00,437,"Emotional exhaustion, the weight of the world crushing weary shoulders. ", WearySoulCrushed , Instagram , #Exhaustion #CrushedSpirit             ,35,70, Canada     ,-0.6705,Negative
2018-05-22 20:45:00,438,"Sorrowful echoes, a symphony of pain played by the strings of loss. ", StringsOfSorrow , Twitter  , #Sorrow #SymphonyOfLoss                ,18,35, Germany     ,-0.7506,Negative
2016-07-10 18:20:00,439,"Darkness descends, engulfing the soul in the shadows of despair.  ", SoulInShadow    , Facebook , #Darkness #SoulEngulfed                 ,28,55, USA         ,-0.5106,Negative
2019-04-30 14:00:00,440,"Desperation whispers, the silent plea for a glimmer of hope in the abyss. ", WhisperedDespair , Instagram , #Desperation #GlimmerOfHope            ,22,45, France    ,-0.0258,Neutral
2022-01-08 11:30:00,441,"Heart in ruins, the remnants of shattered dreams scattered in the wind. ", DreamsInWind    , Twitter  , #Ruins #ShatteredDreams                ,20,40, Brazil     ,-0.5106,Negative
2017-09-10 19:15:00,442,"Shattered by the echoes of a shattered dream, fragments of hope scattered. ", DreamEchoes , Twitter , #Desolation #ScatteredHope ,20,40, Australia ,-0.3182,Negative
2022-04-18 11:30:00,443,"Avoiding the thorns of regret, walking barefoot on the path of remorse. ", RemorseWalker , Instagram , #Regret #PathOfRemorse ,25,50, Canada ,-0.743,Negative
2018-12-05 21:45:00,444,"In the labyrinth of grief, the walls echo with the footsteps of lost joy. ", JoyLabyrinth , Facebook , #Grief #LostJoyFootsteps ,18,35, USA ,-0.1779,Negative
2016-06-28 14:20:00,445,"A soul adrift in the sea of solitude, waves of loneliness crashing relentlessly. ", SolitudeSeas , Twitter , #Loneliness #CrashingWaves ,22,45, UK ,-0.4215,Negative
2019-10-22 17:00:00,446,"The bitterness of betrayal, a taste that lingers, staining the palate of trust. ", PalateStainer , Instagram , #Bitterness #StainedTrust ,15,30, Germany ,-0.4939,Negative
2021-03-15 22:45:00,447,"In the ruins of hope, echoes of shattered dreams whisper tales of loss. ", HopeRuins , Facebook , #Desolation #WhisperedLoss ,28,55, Brazil ,-0.4019,Negative
2017-08-10 19:30:00,448,"Sinking like a stone in the ocean of heartbreak, each ripple a sigh of despair. ", OceanSinker , Twitter , #Heartbreak #RippleOfDespair ,22,45, France ,-0.5267,Negative
2023-01-28 14:30:00,449,"Tears, the ink staining the pages of a journal, a testament to silent grief. ", InkJournalist , Instagram , #Grief #SilentTears ,30,60, India ,-0.6249,Negative
2016-12-12 10:00:00,450,"In the wasteland of lost trust, the echoes of broken promises reverberate. ", TrustWasteland , Facebook , #Betrayal #ReverberatingPromises ,25,50, Italy ,0.128,Positive
2020-07-18 15:15:00,451,"Avoiding the shards of shattered dreams, walking the tightrope of resilience. ", DreamTightrope , Twitter , #Resilience #TightropeWalk ,35,70, Japan ,-0.4215,Negative
2022-05-20 20:30:00,452,"Suffocating in the silence of solitude, where echoes of laughter once thrived. ", EchoedLaughter , Instagram , #Isolation #SilentSolitude ,30,60, South Africa ,0.4939,Positive
2019-11-08 14:45:00,453,"Haunted by the specter of lost possibilities, a ghost that refuses to fade away. ", PossibilityGhost , Twitter , #Regret #FadingPossibilities ,18,35, Spain ,-0.7717,Negative
2017-03-28 22:00:00,454,"In the labyrinth of despair, the echoes of a broken heart reverberate endlessly. ", EndlessLabyrinth , Facebook , #Despair #EndlessReverberation ,28,55, Australia ,-0.6597,Negative
2020-09-15 18:15:00,455,"Sinking like autumn leaves in the river of sorrow, carried away by the current. ", RiverOfSorrow , Instagram , #Sorrow #AutumnLeaves ,22,45, Canada ,-0.2263,Negative
2018-06-10 13:30:00,456,"In the garden of broken dreams, petals fall, a silent testimony to shattered hopes. ", DreamGardener , Twitter , #Desolation #ShatteredHopes ,20,40, UK ,-0.1779,Negative
2016-12-22 21:45:00,457,"Tears, the currency of grief, spent in the marketplace of lost love and longing. ", CurrencyOfTears , Facebook , #Grief #LostLoveLonging ,25,50, USA ,-0.3182,Negative
2021-01-05 16:20:00,458,"Wandering in the maze of betrayal, the walls closing in with every wrong turn. ", MazeWanderer , Instagram , #Betrayal #ClosingWalls ,15,30, Germany ,-0.7845,Negative
2019-04-18 11:00:00,459,"A soul weathered by the storm of heartbreak, seeking refuge in the calm after. ", StormSeeker , Twitter , #Heartbreak #CalmAfterStorm ,22,45, Brazil ,-0.34,Negative
2017-08-28 19:30:00,460,"In the tapestry of despair, threads of hope unravel, leaving a portrait of sorrow. ", TapestrySorrow , Facebook , #Despair #UnraveledHope ,18,35, India ,-0.4215,Negative
2023-02-10 14:30:00,461,"Like a withered rose in the garden of love, petals fall, a silent surrender to time. ", WitheredRose , Instagram , #Loss #SilentSurrender ,28,55, France ,0.7717,Positive
2022-07-10 22:15:00,462,"In the void of heartache, echoes of a love song play, each note a pang of longing. ", LoveSongEcho , Instagram , #Heartache #LoveSongLonging ,30,60, Japan ,0.7579,Positive
2019-05-15 21:30:00,463,"Nostalgia, a bittersweet dance in the moonlit ballroom of cherished memories. ", MoonlitMemories , Twitter , #Nostalgia #CherishedMemories ,18,35, Italy ,0.4588,Positive
2018-11-28 14:00:00,464,"In the symphony of grief, each tear is a note, composing a melancholic melody. ", SymphonyOfTears , Facebook , #Grief #MelancholicMelody ,22,45, Germany ,-0.5423,Negative
2021-03-02 17:45:00,465,"Betrayal, a venomous serpent slithering through the garden of trust, poisoning roots. ", VenomousGarden , Instagram , #Betrayal #PoisonedTrust ,25,50, Canada ,-0.6486,Negative
2016-10-18 19:30:00,466,"Sinking in the quicksand of despair, the harder you fight, the deeper you descend. ", QuicksandFighter , Twitter , #Despair #DeepDescent ,20,40, USA ,-0.5994,Negative
2020-08-15 12:30:00,467,"Wandering through the cemetery of lost dreams, tombstones marking untold sorrows. ", DreamCemetery , Facebook , #Desolation #UntoldSorrows ,28,55, France ,-0.296,Negative
2017-04-28 16:20:00,468,"Swept away by the river of regret, the currents of the past refusing to release. ", RegretRiver , Instagram , #Regret #PastCurrents ,18,35, UK ,-0.6705,Negative
2019-09-10 21:00:00,469,"Whispers of lost love linger in the attic of the heart, forgotten but not erased. ", HeartAttic , Twitter , #Loss #ForgottenLove ,22,45, Australia ,0.128,Positive
2022-01-28 13:45:00,470,"In the gallery of broken promises, each shattered vow framed, a painful exhibition. ", PromiseGallery , Facebook , #Betrayal #ShatteredVows ,15,30, Brazil ,-0.7579,Negative
2016-06-15 22:30:00,471,"The echoes of solitude, a silent conversation between a soul and its shadows. ", EchoedConversation , Instagram , #Solitude #ShadowConversation ,30,60, Spain ,0.0,Neutral
2021-08-20 15:45:00,472,"Dancing on sunshine, each step a celebration of the joy found in simple moments. ", SunshineDancer , Instagram , #Joy #SimpleMoments ,40,80, USA ,0.7906,Positive
2018-04-12 18:30:00,473,"Laughter echoes in the air, a chorus of happiness that lifts the spirit higher. ", EchoedLaughter , Twitter , #Happiness #SpiritLifter ,35,70, Canada ,0.8176,Positive
2022-02-15 12:20:00,474,"In the garden of contentment, each bloom whispers tales of inner peace and joy. ", GardenOfJoy , Facebook , #Contentment #InnerPeace ,25,50, UK ,0.8689,Positive
2019-10-28 14:15:00,475,"Chasing dreams under the vibrant sky, a journey fueled by hope and enthusiasm. ", DreamChaser , Instagram , #Enthusiasm #HopefulJourney ,30,60, Australia ,0.8979,Positive
2017-12-22 21:00:00,476,"Serenading the stars with a heart full of gratitude, a melody of thankfulness. ", StarSerenader , Twitter , #Gratitude #ThankfulMelody ,22,45, India ,0.7506,Positive
2020-06-10 17:30:00,477,"Basking in the glow of accomplishment, each milestone a stepping stone to happiness. ", GlowAchiever , Facebook , #Accomplishment #HappinessMilestone ,28,55, Germany ,0.5574,Positive
2016-09-18 19:45:00,478,"In the dance of positivity, every step is a rhythm, uplifting the soul in harmony. ", DanceHarmony , Instagram , #Positivity #SoulUpliftment ,18,35, France ,0.7184,Positive
2023-03-10 14:30:00,479,"Overflowing with joy, a cup of laughter shared with friends, a moment cherished. ", LaughterCup , Twitter , #Joy #CherishedMoment ,20,40, Japan ,0.9413,Positive
2019-05-05 12:15:00,480,"Draped in the warmth of kindness, a quilt of compassion stitched with love. ", QuiltedCompassion , Facebook , #Kindness #LoveStitches ,25,50, Brazil ,0.9217,Positive
2018-08-28 16:00:00,481,"In the garden of friendships, each bloom a testament to the beauty of camaraderie. ", FriendshipGarden , Instagram , #Friendship #CamaraderieBlooms ,30,60, South Africa ,0.7506,Positive
2022-11-15 20:45:00,482,"In the embrace of love, each heartbeat is a melody, dancing to the rhythm of affection. ", MelodyOfLove , Twitter , #Love #RhythmOfAffection ,35,70, USA ,0.872,Positive
2019-07-02 17:00:00,483,"Surrounded by the colors of joy, a canvas painted with laughter and endless smiles. ", ColorfulLaughter , Instagram , #Joy #EndlessSmiles ,40,80, Canada ,0.8779,Positive
2021-04-18 14:20:00,484,"In the symphony of excitement, each note is a burst of energy, igniting the soul with fervor. ", SymphonyFervor , Facebook , #Excitement #IgnitedSoul ,30,60, UK ,0.6486,Positive
2023-02-05 19:30:00,485,"A surprise gift, wrapped in anticipation, unfolds a moment of delight and wonder. ", WrappedDelight , Twitter , #Surprise #WonderfulMoment ,25,50, Australia ,0.8519,Positive
2018-09-22 12:45:00,486,"Lost in the maze of curiosity, each twist and turn unveils the treasures of discovery. ", MazeDiscovery , Instagram , #Curiosity #TreasuresOfDiscovery ,22,45, India ,0.128,Positive
2016-12-10 21:15:00,487,"Floating on clouds of gratitude, each raindrop a blessing, a shower of thankfulness. ", CloudsOfBlessings , Facebook , #Gratitude #ShowerOfThankfulness ,28,55, Germany ,0.8625,Positive
2020-05-28 16:00:00,488,"Like a comet of inspiration, streaking through the sky of creativity, leaving trails of brilliance. ", CometCreativity , Twitter , #Inspiration #BrilliantTrails ,18,35, France ,0.9081,Positive
2017-11-15 22:30:00,489,"In the celebration of success, fireworks of accomplishment light up the night sky of triumph. ", FireworksTriumph , Instagram , #Success #NightSkyTriumph ,22,45, Japan ,0.7783,Positive
2021-08-02 19:00:00,490,"A symphony of laughter, each note a key to unlocking the door of boundless happiness. ", LaughterSymphony , Facebook , #Happiness #BoundlessLaughter ,30,60, Brazil ,0.7783,Positive
2019-03-28 15:30:00,491,"In the carnival of emotions, the rollercoaster of thrill sends the heart on a wild ride. ", EmotionCarnival , Instagram , #Thrill #WildHeartRide ,35,70, South Africa ,0.3612,Positive
2018-05-12 17:30:00,492,"Standing before the grandeur of the Eiffel Tower, a moment to reflect on the beauty of Parisian dreams. ", ParisDreamer , Twitter , #Reflection #ParisianDreams ,28,55, France ,0.872,Positive
2022-09-28 15:45:00,493,"Lost in the enchantment of Disneyland, each ride a journey into the realm of childhood fantasies. ", DisneylandExplorer , Instagram , #Enchantment #ChildhoodFantasies ,30,60, USA ,-0.3182,Negative
2019-11-10 14:00:00,494,"Exploring the wonders of Ferrari World, the roar of engines creating a symphony of speed. ", FerrariSpeedster , Facebook , #Excitement #SymphonyOfSpeed ,22,45, Italy ,0.296,Positive
2021-04-02 18:20:00,495,"Amidst the tulip fields of Keukenhof, a tapestry of colors that paints the soul with springtime joy. ", KeukenhofAdventurer , Instagram , #Joy #SpringtimeColors ,35,70, Netherlands ,0.5859,Positive
2017-08-22 21:30:00,496,"Wandering through the historical streets of Kyoto, each step a journey into the heart of Japan's traditions. ", KyotoAdventurer , Twitter , #Exploration #JapaneseTraditions ,18,35, Japan ,0.0,Neutral
2020-06-15 16:45:00,497,"In the embrace of the Grand Canyon, nature's masterpiece, a moment to marvel at Earth's grandeur. ", CanyonMarveler , Instagram , #Awe #EarthsGrandeur ,25,50, USA ,0.9393,Positive
2016-09-10 19:15:00,498,"Journeying through the serenity of Santorini, where each sunset paints the sky with hues of tranquility. ", SantoriniTraveler , Facebook , #Serenity #SunsetHues ,22,45, Greece ,0.4215,Positive
2023-01-28 13:00:00,499,"Amazed by the architectural marvels of Petra, each stone telling tales of an ancient civilization. ", PetraExplorer , Twitter , #Amazement #AncientTales ,30,60, Jordan ,0.7351,Positive
2019-04-18 16:30:00,500,"Embarking on a gondola ride in Venice, each canal reflecting the romance of this timeless city. ", VeniceRomantic , Instagram , #Romance #TimelessCity ,20,40, Italy ,0.5574,Positive
2017-11-05 22:00:00,501,"At the summit of Machu Picchu, a breathtaking panorama that whispers the secrets of ancient civilizations. ", MachuPicchuAdventurer , Facebook , #Awe #AncientCivilizations ,28,55, Peru ,0.4588,Positive
2022-07-20 21:45:00,502,"In the heart of New York City, Times Square dazzles with lights, a vibrant spectacle of urban energy. ", TimesSquareExplorer , Instagram , #Excitement #UrbanEnergy ,35,70, USA ,0.6705,Positive
