Timestamp,SR.No,Text,Username,Platform,Hashtags,Retweets,Likes,Country,Sentiment_score,Sentiment
2020-11-29 14:45:00,262," Unveiling the layers of curiosity, a labyrinth of questions leading to the treasure troves of undiscovered knowledge. ", KnowledgeSeeker , Instagram , #Curiosity #LabyrinthOfQuestions ,17,34, USA ,0.296,Positive
2019-09-14 10:20:00,263," In the embrace of the autumn breeze, leaves of ambivalence dancing in a waltz between choices and uncertainties. ", BreezeWaltzer , Facebook , #Ambivalence #AutumnWaltz ,14,28, UK ,-0.0258,Neutral
2022-03-12 19:55:00,264," Gratitude as a guiding star, navigating the constellation of blessings in the vast universe of life's precious moments. ", StarNavigator , Twitter , #Grateful #GuidingStar ,19,38, Australia ,0.8885,Positive
2023-03-30 16:30:00,265," With a zestful heart, sprinting through fields of enthusiasm, chasing sunbeams and laughter in the meadows of joy. ", MeadowSprinter , Instagram , #Zest #FieldsOfEnthusiasm ,16,32, India ,0.872,Positive
2021-07-01 12:10:00,266," A compassionate rain, tears of empathy falling gently, nurturing the seeds of kindness in the garden of human connections. ", RainNurturer , Facebook , #Compassionate #TearsOfEmpathy ,21,42, Canada ,0.8658,Positive
2020-01-05 08:45:00,267," Proudly scaling the peaks of achievement, a mountaineer conquering challenges and planting the flag of success. ", PeakConqueror , Twitter , #Proud #ScalingPeaks ,23,46, USA ,0.8225,Positive
2022-07-17 06:15:00,268," Embraced by the hopeful dawn, a gardener sowing seeds of optimism, tending to the blooms of a brighter tomorrow. ", DawnGardener , Instagram , #Hopeful #SeedsOfOptimism ,14,28, UK ,0.8555,Positive
2018-08-22 17:20:00,269," A playful escapade in the carnival of life, carousel laughter and cotton candy dreams swirling in the joyous atmosphere. ", CarnivalDreamer , Facebook , #Playful #CarnivalEscapade ,24,48, Australia ,0.9169,Positive
2021-12-08 14:30:00,270," Floating on clouds of inspiration, an artist painting the sky with strokes of creativity, creating a masterpiece of dreams. ", SkyArtist , Twitter , #Inspired #CloudsOfCreativity ,18,36, India ,0.9325,Positive
2019-04-27 09:50:00,271," Navigating the river of contentment, a serene boat cruise through the tranquil waters of inner peace and acceptance. ", RiverNavigator , Instagram , #Contentment #TranquilWaters ,20,40, Canada ,0.9042,Positive
2023-09-03 21:40:00,272," With empathy as a lantern, wandering through the dark alleys of sorrow, illuminating the path with compassion and care. ", LanternWanderer , Facebook , #Empathetic #LanternOfCompassion ,16,32, USA ,0.4215,Positive
2020-06-10 10:05:00,273," A free spirit soaring on the wings of dreams, leaving trails of independence in the azure sky of boundless possibilities. ", DreamSoarer , Twitter , #FreeSpirit #WingsOfDreams ,22,44, UK ,0.7717,Positive
2022-04-01 18:30:00,274," Bathed in the golden hues of gratefulness, a sunset of appreciation casting its warm glow on the landscapes of the heart. ", SunsetAdmirer , Instagram , #Grateful #GoldenHues ,19,38, Australia ,0.8126,Positive
2021-01-15 13:00:00,275," Confident strides in the dance of life, a ballroom where self-assuredness leads, twirling through challenges with grace. ", DanceStrider , Facebook , #Confident #DanceOfLife ,23,46, Canada ,0.743,Positive
2023-05-06 07:20:00,276," Hopeful whispers of wind, carrying the promises of a brighter tomorrow, a symphony of optimism in the air of possibilities. ", WindWhisperer , Twitter , #Hopeful #BrighterTomorrows ,15,30, India ,0.9001,Positive
2019-11-18 15:15:00,277," Playfully juggling responsibilities, a circus performer balancing the acts of work and joy, tossing laughter into the air. ", JugglingArtist , Instagram , #Playful #JugglingResponsibilities ,25,50, USA ,0.8625,Positive
2020-08-29 20:45:00,278," Whispering tales of inspiration to the stars, a storyteller crafting constellations from the threads of imagination. ", StarStoryteller , Facebook , #Inspired #TalesToTheStars ,14,28, UK ,0.5267,Positive
2022-10-30 11:40:00,279," Charting a course through the waves of hopeful anticipation, a sailor steering towards the shores of dreams yet unexplored. ", WaveNavigator , Twitter , #Hopeful #SailorOfDreams ,17,34, Australia ,0.7506,Positive
2021-07-01 12:10:00,280," A compassionate rain, tears of empathy falling gently, nurturing the seeds of kindness in the garden of human connections. ", RainNurturer , Instagram , #Compassionate #TearsOfEmpathy ,21,42, Canada ,0.8658,Positive
2020-01-05 08:45:00,281," Proudly scaling the peaks of achievement, a mountaineer conquering challenges and planting the flag of success. ", PeakConqueror , Twitter , #Proud #ScalingPeaks ,23,46, USA ,0.8225,Positive
2022-07-17 06:15:00,282," Embraced by the hopeful dawn, a gardener sowing seeds of optimism, tending to the blooms of a brighter tomorrow. ", DawnGardener , Instagram , #Hopeful #SeedsOfOptimism ,14,28, UK ,0.8555,Positive
2018-08-22 17:20:00,283," A playful escapade in the carnival of life, carousel laughter and cotton candy dreams swirling in the joyous atmosphere. ", CarnivalDreamer , Facebook , #Playful #CarnivalEscapade ,24,48, Australia ,0.9169,Positive
2021-12-08 14:30:00,284," Floating on clouds of inspiration, an artist painting the sky with strokes of creativity, creating a masterpiece of dreams. ", SkyArtist , Twitter , #Inspired #CloudsOfCreativity ,18,36, India ,0.9325,Positive
2019-04-27 09:50:00,285," Navigating the river of contentment, a serene boat cruise through the tranquil waters of inner peace and acceptance. ", RiverNavigator , Instagram , #Contentment #TranquilWaters ,20,40, Canada ,0.9042,Positive
2023-09-03 21:40:00,286," With empathy as a lantern, wandering through the dark alleys of sorrow, illuminating the path with compassion and care. ", LanternWanderer , Facebook , #Empathetic #LanternOfCompassion ,16,32, USA ,0.4215,Positive
2020-06-10 10:05:00,287," A free spirit soaring on the wings of dreams, leaving trails of independence in the azure sky of boundless possibilities. ", DreamSoarer , Twitter , #FreeSpirit #WingsOfDreams ,22,44, UK ,0.7717,Positive
2022-04-01 18:30:00,288," Bathed in the golden hues of gratefulness, a sunset of appreciation casting its warm glow on the landscapes of the heart. ", SunsetAdmirer , Instagram , #Grateful #GoldenHues ,19,38, Australia ,0.8126,Positive
2021-01-15 13:00:00,289," Confident strides in the dance of life, a ballroom where self-assuredness leads, twirling through challenges with grace. ", DanceStrider , Facebook , #Confident #DanceOfLife ,23,46, Canada ,0.743,Positive
2023-05-06 07:20:00,290," Hopeful whispers of wind, carrying the promises of a brighter tomorrow, a symphony of optimism in the air of possibilities. ", WindWhisperer , Twitter , #Hopeful #BrighterTomorrows ,15,30, India ,0.9001,Positive
2019-11-18 15:15:00,291," Playfully juggling responsibilities, a circus performer balancing the acts of work and joy, tossing laughter into the air. ", JugglingArtist , Instagram , #Playful #JugglingResponsibilities ,25,50, USA ,0.8625,Positive
2020-08-29 20:45:00,292," Whispering tales of inspiration to the stars, a storyteller crafting constellations from the threads of imagination. ", StarStoryteller , Facebook , #Inspired #TalesToTheStars ,14,28, UK ,0.5267,Positive
2022-10-30 11:40:00,293," Charting a course through the waves of hopeful anticipation, a sailor steering towards the shores of dreams yet unexplored. ", WaveNavigator , Twitter , #Hopeful #SailorOfDreams ,17,34, Australia ,0.7506,Positive
2021-07-01 12:10:00,294," A compassionate rain, tears of empathy falling gently, nurturing the seeds of kindness in the garden of human connections. ", RainNurturer , Instagram , #Compassionate #TearsOfEmpathy ,21,42, Canada ,0.8658,Positive
2020-01-05 08:45:00,295," Proudly scaling the peaks of achievement, a mountaineer conquering challenges and planting the flag of success. ", PeakConqueror , Twitter , #Proud #ScalingPeaks ,23,46, USA ,0.8225,Positive
2022-07-17 06:15:00,296," Embraced by the hopeful dawn, a gardener sowing seeds of optimism, tending to the blooms of a brighter tomorrow. ", DawnGardener , Instagram , #Hopeful #SeedsOfOptimism ,14,28, India ,0.8555,Positive
2018-08-22 17:20:00,297," A playful escapade in the carnival of life, carousel laughter and cotton candy dreams swirling in the joyous atmosphere. ", CarnivalDreamer , Facebook , #Playful #CarnivalEscapade ,24,48, Australia ,0.9169,Positive
2021-09-15 16:00:00,298," Drowning in the abyss of despair, a heart shattered into fragments, lost in the echoing silence of hopelessness. ", ShatteredHeart , Instagram , #Despair #EchoingSilence ,8,16, Canada ,-0.8957,Negative
2019-03-08 14:20:00,299," Bitterness festering like a venomous vine, entwining the soul in a web of resentment, poisoning the garden of peace. ", VenomousSoul , Facebook , #Bitterness #ResentmentWeb ,12,24, UK ,-0.5267,Negative
2017-07-20 11:45:00,300," Wandering through the desert of loneliness, each step a heavy sigh, mirages of connection shimmering but never materializing. ", DesertWanderer , Twitter , #Loneliness #MiragesOfConnection ,15,30, USA ,-0.2144,Negative
2020-11-02 19:30:00,301," Yearning for a touch that's not there, echoes of a distant warmth haunting the heart in the cold embrace of solitude. ", ColdEmbrace , Instagram , #Yearning #DistantWarmth ,10,20, Australia ,0.5719,Positive
2022-05-12 02:00:00,302," Eyes wide open in the night, fearful shadows dancing on the walls, the mind a prisoner of imagined horrors. ", NightPrisoner , Facebook , #Fearful #ImaginedHorrors ,18,36, India ,-0.886,Negative
2023-04-08 13:15:00,303," Apprehensive steps on the tightrope of uncertainty, a balancing act where the fall seems inevitable, anxiety a constant companion. ", TightropeWalker , Twitter , #Apprehensive #BalancingAct ,14,28, UK ,-0.4767,Negative
2021-06-25 17:50:00,304," Overwhelmed by the weight of the world, Atlas with trembling shoulders, each responsibility a boulder in the landscape of exhaustion. ", AtlasBearer , Instagram , #Overwhelmed #BouldersOfExhaustion ,22,44, Canada ,-0.5859,Negative
2019-08-30 10:10:00,305," Jealousy, a green-eyed monster, lurking in the shadows, casting a dark cloud over the sunshine of others' success. ", GreenMonster , Facebook , #Jealous #GreenEyedMonster ,16,32, USA ,0.6249,Positive
2022-08-03 15:30:00,306," Devastated by the storm of betrayal, the wreckage of trust scattered like debris, a heart torn by the winds of broken promises. ", StormSurvivor , Twitter , #Devastated #WindsOfBrokenPromises ,25,50, Australia ,-0.6705,Negative
2020-12-17 09:20:00,307," Frustrated fingers tapping on the keyboard, a symphony of annoyance composing an unsolvable puzzle of unmet expectations. ", PuzzleComposer , Instagram , #Frustrated #UnsolvablePuzzle ,12,24, India ,-0.6908,Negative
2021-02-28 22:45:00,308," Envious eyes fixated on the gilded prize, a heartache fueled by the painful desire for possessions that seem forever out of reach. ", GildedHeartache , Facebook , #Envious #GildedPrize ,20,40, USA ,0.2732,Positive
2018-05-10 14:00:00,309," Dismissive glances, a fortress built with indifference, walls impenetrable to the pleas of understanding and recognition. ", IndifferentFort , Twitter , #Dismissive #ImpenetrableWalls ,14,28, UK ,-0.0516,Negative
2022-01-07 11:10:00,310," Shattered dreams lie on the floor like fragments of glass, a mosaic of disappointment crafted by the hands of frustration. ", DreamMosaic , Instagram , #Frustrated #MosaicOfDisappointment ,15,30, Canada ,-0.6486,Negative
2019-09-19 03:30:00,311," Loneliness, a silent companion in the night, the only echo in the chamber of solitude, a heart's solitary nocturne. ", NocturnalEcho , Facebook , #Loneliness #SolitaryNocturne ,18,36, Australia ,-0.4215,Negative
2023-07-14 23:00:00,312," Fearful whispers in the dark, the mind haunted by the specter of the unknown, shadows dancing to the rhythm of anxiety's tune. ", DarkWhispers , Twitter , #Fearful #SpecterOfTheUnknown ,13,26, UK ,-0.743,Negative
2020-04-05 16:20:00,313," Bitterness, a bitter aftertaste lingering on the tongue, each word a reminder of wounds that refuse to heal with the passing of time. ", LingeringTaste , Instagram , #Bitterness #BitterAftertaste ,10,20, India ,-0.7717,Negative
2021-11-29 08:45:00,314," Overwhelmed by the cacophony of expectations, a drowning soul in the tempest of pressure, struggling to stay afloat. ", TempestSurvivor , Facebook , #Overwhelmed #DrowningSoul ,20,40, USA ,-0.5859,Negative
2019-12-12 17:00:00,315," Jealousy, a venom that seeps through the veins, poisoning the heart and turning it into a breeding ground for discontent. ", VenomousHeart , Twitter , #Jealous #HeartOfDiscontent ,16,32, Australia ,-0.7269,Negative
2022-05-20 14:50:00,316," Devastated by the revelation of betrayal, the trust shattered like fragile glass, leaving shards of pain in its wake. ", FragileTrust , Instagram , #Devastated #ShatteredTrust ,25,50, Canada ,-0.8555,Negative
2020-09-03 12:15:00,317," Frustrated attempts to mend a broken connection, the threads of understanding slipping through the fingers like grains of sand. ", BrokenThreads , Facebook , #Frustrated #SlippingThreads ,14,28, UK ,-0.6124,Negative
2021-02-10 19:30:00,318," Envious gazes cast upon the podium of success, a bitter pill swallowed, the taste lingering as a constant reminder of unattained heights. ", SuccessPill , Twitter , #Envious #BitterPill ,20,40, USA ,-0.0516,Negative
2018-08-18 14:40:00,319," Dismissive gestures, a curtain drawn to shield the vulnerability, a stage where emotions take a backseat to the performance of indifference. ", CurtainShield , Instagram , #Dismissive #IndifferencePerformance ,12,24, Australia ,-0.2732,Negative
2022-02-28 21:00:00,320," Despair like a heavy fog, enveloping every thought, blurring the path ahead, a journey in the labyrinth of utter hopelessness. ", FoggyLabyrinth , Facebook , #Despair #LabyrinthOfHopelessness ,8,16, Canada ,-0.5994,Negative
2019-10-15 10:30:00,321," Bitterness, a bitter chill in the air, freezing moments into icicles of resentment that dangle precariously over the landscape of memory. ", IcyResentment , Twitter , #Bitterness #IciclesOfResentment ,15,30, UK ,-0.8316,Negative
2017-12-01 18:50:00,322," Loneliness, a solitary moon in a starless sky, casting a cold glow on the landscape of isolation, where echoes bounce in empty spaces. ", SolitaryMoon , Instagram , #Loneliness #StarlessSky ,18,36, USA ,-0.743,Negative
2020-04-18 16:15:00,323," Yearning for the warmth of a vanished sun, a heartache painted in the hues of a sunset that never graced the horizon. ", VanishedSunset , Facebook , #Yearning #HuesOfSunset ,10,20, Australia ,0.428,Positive
2023-01-07 03:30:00,324," Fearful eyes scanning the shadows, a prisoner of the night, terrorized by the lurking monsters born from the mind's darkest corners. ", NightPrisoner , Twitter , #Fearful #LurkingMonsters ,18,36, India ,-0.9382,Negative
2021-06-10 10:00:00,325," Apprehensive whispers in the wind, a forecast of uncertainty, the mind's weather vane spinning wildly in the storm of doubt. ", WindWhisperer , Instagram , #Apprehensive #StormOfDoubt ,14,28, Canada ,-0.5994,Negative
2020-02-22 15:20:00,326," Overwhelmed by the maze of expectations, a minotaur of pressure lurking in the labyrinth, waiting to devour the spirit of resilience. ", MazeExplorer , Facebook , #Overwhelmed #MinotaurOfPressure ,22,44, USA ,-0.2023,Negative
2018-03-17 14:45:00,327," Jealousy, a festering wound, the pain intensifying with each glance at the garden of others' achievements, blooming beyond the fence. ", WoundedGarden , Twitter , #Jealous #BloomingAchievements ,16,32, UK ,-0.6808,Negative
2022-10-28 11:15:00,328," Devastated, a heart in ruins, the echoes of shattered dreams reverberating in the chambers, a requiem for what once was whole. ", RuinedHeart , Instagram , #Devastated #EchoesOfShatteredDreams ,25,50, Australia ,-0.8074,Negative
2020-11-01 12:30:00,329," Frustrated attempts to untangle the knot of confusion, the threads of understanding slipping further into the labyrinth of miscommunication. ", KnotUntangler , Facebook , #Frustrated #LabyrinthOfMiscommunication ,14,28, India ,-0.6808,Negative
2021-01-15 22:10:00,330," Envious eyes locked on the treasure chest of opportunities, a heartache fueled by the desire for keys that seem forever elusive. ", ElusiveKeys , Twitter , #Envious #DesireForKeys ,20,40, USA ,0.6597,Positive
2018-08-18 14:00:00,331," Dismissive gestures, a curtain drawn to shield the vulnerability, a stage where emotions take a backseat to the performance of indifference. ", IndifferentFort , Instagram , #Dismissive #IndifferencePerformance ,12,24, Australia ,-0.2732,Negative
2022-01-07 11:10:00,332," Shattered dreams lie on the floor like fragments of glass, a mosaic of disappointment crafted by the hands of frustration. ", DreamMosaic , Twitter , #Frustrated #MosaicOfDisappointment ,15,30, Canada ,-0.6486,Negative
2019-09-19 03:30:00,333," Loneliness, a silent companion in the night, the only echo in the chamber of solitude, a heart's solitary nocturne. ", NocturnalEcho , Facebook , #Loneliness #SolitaryNocturne ,18,36, Australia ,-0.4215,Negative
2022-04-03 06:15:00,334,Awe-struck by the breathtaking sunrise over the mountains.      , NatureAdmirer  , Instagram , #Awe #BreathtakingSunrise                   ,28,55, USA               ,0.4588,Positive
2023-10-12 10:30:00,335,Navigating through the challenges with determination.          , GoalPursuer    , Twitter  , #Determination #Challenges                  ,15,30, Canada            ,0.4588,Positive
2019-06-28 19:00:00,336,Nostalgia hits while flipping through an old photo album.     , MemoryLane     , Facebook , #Nostalgia #OldMemories                     ,22,45, UK                ,0.0,Neutral
2020-09-15 14:45:00,337,Thrilled to witness the grandeur of a cultural festival.       , CultureEnthusiast , Instagram , #Thrill #CulturalCelebration              ,40,80, India              ,0.8591,Positive
2017-11-08 21:20:00,338,Calmness found in the rhythm of raindrops on the windowpane.   , RainWatcher    , Twitter  , #Calmness #RainyDays                        ,18,35, Australia          ,0.4019,Positive
2021-05-20 17:30:00,339,Overwhelmed by the support received during a personal challenge., PersonalJourney , Facebook , #Overwhelmed #SupportiveCommunity          ,25,50, USA               ,0.4939,Positive
2023-01-10 12:00:00,340,Excitement builds as the countdown to a long-awaited vacation begins. , VacationDreamer , Instagram , #Excitement #VacationCountdown        ,30,60, France            ,0.4939,Positive
2018-12-05 08:45:00,341,"Reflecting on life's journey, grateful for the lessons learned. ", LifeLearner   , Twitter  , #Gratitude #LifeLessons                    ,35,70, Brazil            ,0.4588,Positive
2020-03-15 18:30:00,342,Bittersweet emotions arise while bidding farewell to a dear friend. , FarewellSender , Instagram , #Bittersweet #Farewell                     ,20,40, Japan             ,0.6705,Positive
2016-08-22 15:10:00,343,Curiosity sparked by exploring a mysterious ancient ruin.      , HistoryExplorer , Facebook , #Curiosity #AncientDiscovery          ,18,35, Greece            ,-0.5859,Negative
2019-08-20 16:00:00,344,Admiration for the intricate details of a handcrafted masterpiece. , CraftEnthusiast , Instagram , #Admiration #HandcraftedArt               ,25,50, USA               ,0.8481,Positive
2021-12-08 19:30:00,345,Overjoyed by the warmth of a cozy fireplace on a winter evening.   , WinterLover     , Twitter  , #Overjoyed #WinterWarmth                  ,18,35, Canada            ,0.7717,Positive
2020-06-10 20:45:00,346,Inspiration strikes while observing the colors of a vibrant sunset., SunsetWatcher   , Instagram , #Inspiration #ColorfulSunset             ,30,60, UK                ,0.6486,Positive
2022-02-28 07:15:00,347,Motivated to achieve fitness goals after an invigorating workout.  , FitnessJunkie   , Facebook , #Motivation #FitnessGoals                 ,40,80, Australia          ,0.802,Positive
2017-04-15 08:00:00,348,Gratitude for the simple joys found in a cup of morning coffee.    , CoffeeLover     , Twitter  , #Gratitude #MorningCoffee                 ,22,45, India             ,0.7579,Positive
2018-09-05 14:20:00,349,Feeling empowered after conquering a challenging hiking trail.     , HikingExplorer  , Instagram , #Empowerment #HikingAdventure             ,35,70, USA               ,0.2732,Positive
2022-10-22 12:45:00,350,Amused by the antics of playful kittens during playtime.           , KittyObserver   , Facebook , #Amusement #PlayfulKittens               ,15,30, Canada            ,0.6908,Positive
2016-07-02 23:30:00,351,Contemplating life's mysteries under the starry night sky.         , Stargazer       , Twitter  , #Contemplation #StarryNight               ,28,55, UK                ,0.0,Neutral
2020-11-18 17:10:00,352,Joyful reunion with long-lost friends after years of separation.   , FriendshipRenewal , Instagram , #JoyfulReunion #Friendship               ,20,40, India             ,0.7906,Positive
2023-03-05 15:00:00,353,Excitement builds while preparing for a surprise celebration.     , CelebrationPlanner , Facebook , #Excitement #SurpriseCelebration         ,30,60, Australia          ,0.6486,Positive
2015-12-01 11:30:00,354,Satisfaction derived from successfully completing a DIY project.  , DIYEnthusiast   , Twitter  , #Satisfaction #DIYProject                 ,25,50, USA               ,0.7269,Positive
2021-09-10 09:45:00,355,Feeling blessed for the supportive community in times of need.    , CommunityHelper , Instagram , #Blessed #SupportiveCommunity            ,18,35, UK                ,0.765,Positive
2018-05-12 14:20:00,356,Captivated by the serenity of a tranquil garden in full bloom.     , GardenEnthusiast , Facebook , #Serenity #TranquilGarden                ,22,45, Canada            ,0.4215,Positive
2022-07-25 10:00:00,357,Anticipation for an upcoming adventure in an exotic destination.   , Wanderlust      , Twitter  , #Anticipation #AdventureAwaits           ,40,80, India             ,0.4019,Positive
2019-03-08 18:30:00,358,Reflecting on personal growth achieved through life experiences.  , GrowthSeeker    , Instagram , #Reflection #PersonalGrowth              ,35,70, USA               ,0.3818,Positive
2017-01-28 21:15:00,359,Nostalgic memories flood in while revisiting childhood favorites. , ChildhoodMemories , Facebook , #Nostalgia #ChildhoodFavorites           ,20,40, Australia          ,0.4215,Positive
2016-11-14 13:45:00,360,Appreciation for the vibrant culture experienced during travel.   , CultureExplorer , Twitter  , #Appreciation #CulturalExperience        ,28,55, UK                ,0.7717,Positive
2020-04-02 17:30:00,361,Confidence soars after overcoming public speaking anxiety.       , PublicSpeaker   , Instagram , #Confidence #OvercomingAnxiety          ,15,30, USA               ,0.3818,Positive
2023-01-15 19:00:00,362,Contentment in the midst of a family gathering filled with laughter. , FamilyCelebration , Facebook , #Contentment #FamilyLaughter             ,25,50, Canada            ,0.6908,Positive
2018-08-07 12:15:00,363,Enthusiasm for learning new skills and expanding knowledge.      , LifelongLearner , Twitter  , #Enthusiasm #SkillBuilding               ,30,60, India             ,0.4404,Positive
2019-10-18 16:45:00,364,Surprise and delight at discovering a hidden gem in the city.    , CityExplorer    , Instagram , #Surprise #HiddenGem                      ,18,35, UK                ,0.7184,Positive
2022-06-30 07:00:00,365,A sense of accomplishment after completing a challenging workout., FitnessAchiever , Facebook , #Accomplishment #FitnessSuccess         ,22,45, Australia          ,0.1531,Positive
2017-06-12 18:20:00,366,Wonderment at the beauty of a double rainbow after the rain.     , RainbowChaser   , Twitter  , #Wonderment #DoubleRainbow               ,35,70, USA               ,0.5859,Positive
2021-07-05 09:30:00,367,Optimism for a bright future amidst challenging times.           , FutureOptimist  , Instagram , #Optimism #BrightFuture                  ,20,40, Canada            ,0.7906,Positive
2016-04-15 14:50:00,368,Pride in achieving a personal milestone in career progression.   , CareerAchiever  , Facebook , #Pride #CareerMilestone                  ,28,55, UK                ,0.34,Positive
2020-02-10 11:15:00,369,Happiness blooms like flowers in a garden on a sunny day.        , SunnyDayEnthusiast , Twitter  , #Happiness #SunnyDay                      ,15,30, India             ,0.836,Positive
2018-09-22 16:30:00,370,Elation over discovering a rare book in a quaint bookstore.      , Bookworm        , Instagram , #Elation #RareBookDiscovery              ,40,80, USA               ,0.3612,Positive
2015-11-08 10:00:00,371,Curiosity piqued by the mysteries of an ancient archaeological site., ArchaeologyEnthusiast , Facebook , #Curiosity #AncientMysteries            ,18,35, Australia          ,0.0258,Neutral
2022-08-10 22:00:00,372,Mesmerized by the cosmic dance of fireflies on a moonlit night.    , NightSkyObserver , Instagram , #Enchantment #CosmicFireflies             ,25,50, Brazil           ,0.0,Neutral
2019-04-05 17:30:00,373,Intrigued by the symphony of colors in an abstract art exhibition. , ArtConnoisseur  , Twitter  , #Intrigue #AbstractArt                   ,18,35, France           ,0.0,Neutral
2020-12-15 15:45:00,374,Giggles and joy echo in the air during a children's playdate.      , PlayfulParent   , Facebook , #PlayfulJoy #ChildrensPlaydate           ,22,45, Japan            ,0.6808,Positive
2017-10-20 08:15:00,375,Enveloped in serenity while practicing mindfulness by the lake.    , ZenSeeker       , Instagram , #Mindfulness #LakeTranquility            ,35,70, Canada           ,0.0,Neutral
